event_id,source,title,url,publish_time,author,content,like_count,share_count,comment_count,read_count
124,南方周末,医学生侮辱大体老师引舆论哗然：没有人伦底线何来医者仁心？丨快评,https://www.infzm.com/contents/281084,2024-10-23 12:00:00,辛省志,"医学最终目的是治病救人，这意味着，医学要与人打交道，除了科学的部分之外，医学也必然需要人文情怀，医生必须要对病人、对生命充满关怀、尊重和敬畏。尊重生命是医学的底色，培养医学人文精神是医学教育的重要组成部分。

医学生如果“无所畏惧”到连生命都不知敬畏，让人如何相信他们将来会真正关爱生命，关爱病人？",52,50,26,
125,南方周末,新冠增加心脑血管疾病风险的新认识,https://www.infzm.com/contents/281055,2024-10-23 10:00:00,南方周末特约撰稿 袁端端,最新研究为新冠病毒对心血管的长期潜在影响提供了新的认识，在新冠疫情早期感染原始毒株的未接种疫苗者，罹患心脏病、中风及全因死亡的风险显著增加，且在感染三年后没有减缓的迹象。,10,26,3,
126,南方周末,#科创连连问【宋亚宸】,https://www.infzm.com/contents/281067,2024-10-23 09:07:52,南方周末科创力研究中心,,0,0,0,
127,南方周末,这两本新书，书写了75年的“广东日记”,https://www.infzm.com/contents/281065,2024-10-23 09:00:00,南方周末记者 冯飞,一部广东当代史，一个全国典型样本。,4,2,4,
128,南方周末,真心熔金丨姚大力读《程应镠文学文存》,https://www.infzm.com/contents/281028,2024-10-23 08:00:00,姚大力,由文学而通达人情，由通人情而能胜人一筹地洞悉人的历史。今天的我们只能高山仰止，那已经是我们这一代人学不来的本领。,4,33,1,
129,南方周末,神舟十九号计划近日择机实施发射，船箭组合体转运至发射区,https://www.infzm.com/contents/281059,2024-10-22 22:32:01,新华社,,6,3,2,
130,南方周末,代发“爽文”未满十天，我发现自己的阅读思维在被悄悄改变,https://www.infzm.com/contents/281044,2024-10-22 22:00:00,夜雅,被迫停止代发后，回看自己边发边读的时间，发现虽然流量不好，但被“洗脑”倒是很快……,23,11,4,
131,南方周末,八卷本《肖洛霍夫文集》出版往事，兼忆李福清,https://www.infzm.com/contents/281024,2024-10-22 20:00:00,张福生,在我编辑《肖洛霍夫文集》的五年中，孙美玲老师对我的帮助非常之大，使我有一种读研究生的感觉，她是导师，带我研究了五年肖洛霍夫。,5,13,1,
132,南方周末,从帝王师到“知其不可为而为之”：谈谈诸葛亮在中国文化史上的象征,https://www.infzm.com/contents/281032,2024-10-22 18:00:00,刘勃,"既然一定会失败，为什么还要做呢？

因为有亡国，有亡天下。古代的国，含义和今天不同，改朝换代，是亡国；仁义礼智信这些儒家心目中最基本的人伦，这个要是丢了，是亡天下。

面对无法战胜的黑暗势力，不可抗拒的时代洪流，抵抗了，失败了，那是亡国了，但是天下不亡，因为奋勇抗争，鞠躬尽瘁死而后已的精神，可以激励世世代代的无数的后来人；知道抵抗不了，就缴械投降，同流合污，那就不但亡国，而且亡天下。

所以虽然知其不可为，但是还是一定要有为。

这个精神，在诸葛亮身上，得到完美的体现。",19,14,3,
133,南方周末,养子的逆袭：沐英在云南,https://www.infzm.com/contents/281026,2024-10-22 17:00:00,王在田,"读明史征南事迹，我一直有个疑问：攻伐云南真的是沐英的才智勇略大爆发吗？《明史》对于征南副将军蓝玉在征南战役中的记载只有区区五十四个字，对于征南将军傅友德也不满两百字。云南，仿佛就是沐英单枪匹马收复的——毕竟，历史是由幸存者书写的。

然而，哀牢山也给了沐英一个证明自己的机会。",36,51,8,
134,南方周末,外交部：中印双方已就边境问题达成解决方案,https://www.infzm.com/contents/281046,2024-10-22 15:40:39,央视新闻,,21,16,4,
135,南方周末,善择ESG风险跟踪第55期｜131家公司暴露ESG风险，泉阳泉喊话离岗多年员工回来上班引发热议,https://www.infzm.com/contents/281040,2024-10-22 15:31:11,南方周末中国企业社会责任研究中心,,2,7,0,
136,南方周末,#科创连连问【丁泓禹】,https://www.infzm.com/contents/281042,2024-10-22 15:17:31,"
南方周末科创力研究中心",他曾是3M中国最早的技术服务工程师之一，现在是3M全球资深副总裁兼3M中国总裁，亲历3M中国从进口产品代理到建立创新体系并不断推出创新产品的全过程。,0,0,0,
137,南方周末,检查结果互联互通：有助于患者福祉与医保控费丨快评,https://www.infzm.com/contents/281038,2024-10-22 15:00:00,陈斌,就检查结果互联互通而言，医院的动力显然是不足的；一般而言患者的动机还是比较强的，但若是有基本医保，在不需要出钱或出钱比例不高的情况之下，动机就会减弱不少。,16,21,5,
138,南方周末,穷小子翻身的危险游戏，没有人是赢家,https://www.infzm.com/contents/280557,2024-10-22 14:00:00,飞白,,8,4,2,
139,南方周末,艾略特·温伯格：我在疫情期间读了1600首杜甫诗歌,https://www.infzm.com/contents/280992,2024-10-22 12:00:00,南方人物周刊记者 孙凌宇 南方人物周刊实习记者 林锦淼,"“美国是唯一一个不以其文化生产者为荣的国家。在纽约，没有任何东西是以曾经在纽约生活过的最著名作家的名字命名的，比如沃尔特·惠特曼或赫尔曼·梅尔维尔。从政者里，奥巴马是个例外，但除此之外就不是了。没有一个国会议员能说出一位在世美国诗人的名字，也许他们会认识写惊悚小说的，比如斯蒂芬·金”

（本文首发于南方人物周刊）",9,10,2,
140,南方周末,司法部原副部长刘志强被“双开”,https://www.infzm.com/contents/281016,2024-10-22 10:05:50,央视新闻,,9,1,3,
141,南方周末,第一次搞懂“平仓”，是为了买一只玲娜贝儿,https://www.infzm.com/contents/280617,2024-10-22 10:00:00,雨衣,买基金买黄金，都不如买玩偶？,5,14,6,
142,南方周末,梁龙：这个世界转得不够快,https://www.infzm.com/contents/280984,2024-10-22 09:00:00,南方人物周刊记者 孟依依,"极限本身所包含的刺激感和可能性多年来都在诱惑他。“还行就是不行。”二十多岁的梁龙这么说过，到了47岁，他仍旧坚持“什么事都到极限才有意思”

（本文首发于南方人物周刊）",7,6,0,
143,南方周末,巨头齐下场，AI的尽头是核能？,https://www.infzm.com/contents/281010,2024-10-21 22:47:37,南方周末科创力研究中心,难道真的应了那句，“AI的尽头是核能”？！,14,10,1,
144,南方周末,国考30年，招录人数再创历史新高,https://www.infzm.com/contents/280971,2024-10-21 22:32:47,,,4,6,0,
145,南方周末,我国首部肥胖症诊疗权威指南发布｜周一健,https://www.infzm.com/contents/281008,2024-10-21 22:32:47,南方周末记者 宋炳晨,目前在我国有五种减重药物获得国家药品监督管理局批准，用于成年原发性肥胖症患者减重，包括司美格鲁肽、替尔泊肽、利拉鲁肽、贝那鲁肽、奥利司他，其中前四种均为GLP-1类药物。,10,8,5,
146,南方周末,高位截瘫后成为时尚博主：“我们其实比自己想象的要更坚强”,https://www.infzm.com/contents/280987,2024-10-21 22:00:00,南方人物周刊记者 聂阳欣,"她在希望和绝望中反复煎熬，身体疼痛、情绪崩溃的时候，她想着死了算了，但有时仅仅是吃一顿饭，出门看到蓝天，又会让她庆幸自己还活着。“其实你没法选择，人要么死，要么活，活下去只能硬着头皮往下走，但觉得还是活着更好。”

（本文首发于南方人物周刊）",46,46,17,
147,南方周末,钱锺书自嘲“枯蜗”,https://www.infzm.com/contents/280886,2024-10-21 20:00:00,裴伟,钱锺书给汪荣祖的信算是调侃，总之，“蝟”“蜗”钱先生不会混淆。,8,54,1,
148,南方周末,专访陈好：真人秀的真，也是做自己,https://www.infzm.com/contents/280955,2024-10-21 18:00:00,王萌 林小桐,,5,4,2,
149,南方周末,梁强当选越南国家主席,https://www.infzm.com/contents/280982,2024-10-21 17:41:23,新华社,,4,1,3,
